,titles,body_contents,tags,sentiment_score,positive_words,negative_words
7,BuzzFeed Shares Soar as Publisher Plans to Use ChatGPT Creator OpenAI for Content,"BuzzFeed plans to use ChatGPT Creator OpenAI tools to help produce some of its content, joining the growing list of digital publishers planning to incorporate artificial intelligence into their business operations, according to a memo reviewed by The Wall Street Journal. The digital publisher’s shares rose 120 percent, to $2.09 on Jan. 27 after gaining more than 150 percent in trading on Jan. 26 following the news. Year to date, the stock is up 186 percent. The newspaper reported that the website sent a memo to staff on Jan. 26 to confirm that BuzzFeed will use AI to produce content with the goal of “enhancing the quiz experience, informing our brainstorming, and personalizing our content for our audience.” “Our industry will expand beyond AI-powered curation (feeds), to AI-powered creation (content),” BuzzFeed CEO Jonah Peretti said. “AI opens up a new era of creativity, where creative humans like us play a key role in providing the ideas, cultural currency, inspired prompts, IP, and formats that come to life using the newest technologies.” The Journal cited one example of what AI could do for BuzzFeed. The technology could create customized romantic-comedy pitches by asking the audience for personal information, which would then create unique ideas with these responses. The news comes after it was revealed that BuzzFeed would be earning millions of dollars from Facebook parent Meta Platforms to bring more creator content to Facebook and Instagram. This also comes about a month after BuzzFeed announced plans to cut 180 jobs, representing about 12 percent of its workforce. The company intends to slash most of its positions by the end of the first quarter. “In order for BuzzFeed to weather an economic downturn that I believe will extend well into 2023, we must adapt, invest in our strategy to serve our audience best, and readjust our cost structure,” Peretti said in a memo to employees. Since going public in December 2021 following a reverse merger with a special purpose acquisition company (SPAC), BuzzFeed’s shares had tumbled to less than $1. The firm has been battered and bruised by a combination of factors, including constant revenue misses, declining readership, bearish guidance, and waning enthusiasm over SPACs. The consensus analyst price target is $3 in 2023. While BuzzFeed confirmed that it’s dedicated to human-generated journalism, more companies are complementing their content production with AI. More Businesses Betting on AI Since its debut in November 2022, ChatGPT has become widely popular among consumers and businesses. However, at the time of this writing, the digital tool was “at capacity” and unable to use. Many industry observers have warned that the AI chatbot could be a significant disruptor, as it has been found to be able to pass medical exams and master of business administration tests at the Wharton School of the University of Pennsylvania. Companies are betting big on ChatGPT. Microsoft, for example, recently invested $10 billion in OpenAI as part of a multiyear deal. The tech juggernaut plans to integrate ChatGPT and other AI tools into its suite of products. This would be the third agreement between",[],0.25,"['help', 'growing', 'intelligence', 'shares', 'gaining', 'expand', 'creation', 'creativity', 'creative', 'like', 'play', 'inspired', 'create', 'romantic', 'comedy', 'create', 'extend', 'well', 'best', 'special', 'shares', 'enthusiasm', 'dedicated', 'popular', 'significant', 'agreement']","['cut', 'slash', 'misses', 'warned']"
8,Microsoft Announces ‘Multibillion-Dollar Investment’ in Artificial Intelligence ChatGPT Creator,"Microsoft is investing billions in OpenAI, the creator of the artificial intelligence system ChatGPT, the tech giant has confirmed. In a blog post on Jan. 23, the company announced the third phase of its “long-term partnership with OpenAI” through a multiyear, multibillion-dollar investment aimed at accelerating “AI breakthroughs to ensure these benefits are broadly shared with the world.” Microsoft previously made investments in OpenAI in 2019 and 2021, the company said. According to the tech giant —which stopped short of revealing the exact amount it was investing in the AI research and deployment company—the funding will go toward the development and deployment of specialized supercomputing systems to “accelerate OpenAI’s groundbreaking independent AI research.” The company will also deploy OpenAI’s models across its consumer and enterprise products and “introduce new categories of digital experiences” built on OpenAI’s technology. Microsoft is the exclusive provider of cloud computing services to OpenAI through its Azure platform. According to the blog post, Azure will power all OpenAI workloads across research, products, and API services. Developing AI That Is ‘Safe, Useful, and Powerful’ “We formed our partnership with OpenAI around a shared ambition to responsibly advance cutting-edge AI research and democratize AI as a new technology platform,” said Satya Nadella, chairman and CEO of Microsoft. “In this next phase of our partnership, developers and organizations across industries will have access to the best AI infrastructure, models, and toolchain with Azure to build and run their applications.” In a separate blog post published on Monday, OpenAI said that Microsoft’s multiyear investment will help the company “continue our independent research and develop AI that is increasingly safe, useful, and powerful.” ChatGPT is a free-to-use artificial intelligence chatbot that can produce human-like speech in a conversational way. Specifically, it can answer questions, write fiction and non-fiction content when prompted, perform calculations, and translate text from one language to another. Most recently, the chatbot was able to pass a graduate-level business examination at the University of Pennsylvania’s Wharton School, according to a new research paper by Christian Terwiesch, a professor at the school. The software, which is trained using reinforcement learning from human feedback (RLHF), initially debuted in November last year and quickly went viral, crossing the mark of one million users within just five days. However, some experts have raised concerns that the chatbot could be used in negative ways, including helping students cheat on their exams and homework. Schools Block ChatGPT Over Cheating Concerns The Los Angeles Unified School District was one of the first districts to block ChatGPT in December in an effort to “protect academic honesty.” Earlier this month, the New York City Department of Education blocked ChatGPT service access on its networks and devices, citing concerns over negative impacts on student learning and the safety and accuracy of its content. Elsewhere, a representative for Seattle Public Schools told Geekwire last week that the district banned ChatGPT from all school devices, again citing concerns over cheating. OpenAI acknowledges that ChatGPT is not always correct. Addressing concerns from schools regarding the chatbot, OpenAI CEO Sam Altman said during an",[],0.11,"['intelligence', 'ensure', 'benefits', 'shared', 'exclusive', 'Safe', 'Useful', 'Powerful', 'shared', 'best', 'help', 'safe', 'useful', 'powerful', 'free', 'intelligence', 'like', 'helping', 'Unified', 'protect', 'honesty', 'safety']","['stopped', 'cutting', 'negative', 'cheat', 'Block', 'Cheating', 'block', 'blocked', 'negative', 'banned', 'cheating']"
9,Artificial Intelligence ChatGPT Passes Top Business School Exam,"ChatGPT, an artificial intelligence system, passed a graduate-level business examination at the University of Pennsylvania’s Wharton School, according to a new research paper. Christian Terwiesch, a professor at Wharton, considered one of the most prestigious business schools in the United States, said he wanted to test growing concerns about the chatbot’s potential. It comes amid a surge of concerns from academics that students would use the tool to cheat on their exams and homework. In his paper titled “Would Chat GPT3 Get a Wharton MBA?” Terwiesch concluded that “Chat GPT3 would have received a B to B- grade on the exam,” which “has important implications for business school education.” He suggested the school overhaul its exam rules, teaching, and curriculum. Elaborating, he wrote the AI system displayed “a remarkable ability to automate some of the skills of highly compensated knowledge workers in general and specifically the knowledge workers in the jobs held by MBA graduates including analysts, managers, and consultants.” The bot was designed to give a human-like conversation via artificial intelligence. The chatbot, designed for mass market usage, also “demonstrated the capability of performing professional tasks such as writing software code and preparing legal documents,” his paper said (pdf). During one instance, ChatGPT did “an amazing job” and provided answers that were correct or “excellent.” “ChatGPT3 is remarkably good at modifying its answers in response to human hints. In other words, in the instances where it initially failed to match the problem with the right solution method, Chat GPT3 was able to correct itself after receiving an appropriate hint from a human expert,” his paper said. Launched in November of last year, OpenAI says ChatGPT describes itself as a “large language model” that can be used for “natural language processing tasks such as text generation and language translation.” The “GPT” in the name is short for “Generative Pretrained Transformer.” “One of the key features of ChatGPT is its ability to generate human-like text responses to prompts,” maker OpenAI says. “This makes it useful for a wide range of applications, such as creating chatbots for customer service, generating responses to questions in online forums, or even creating personalized content for social media posts.” Terwiesch compared ChatGPT’s potential with the effect that electronic calculators had on the corporate world. “Prior to the introduction of calculators and other computing devices, many firms employed hundreds of employees whose task it was to manually perform mathematical operations such as multiplications or matrix inversions,” he wrote. “Obviously, such tasks are now automated, and the value of the associated skills has dramatically decreased. In the same way any automation of the skills taught in our MBA programs could potentially reduce the value of an MBA education.” But Terwiesch clarified that ChatGPT made some glaring errors. For example, the AI system made “surprising mistakes in relatively simple calculations” on sixth-grade-level math problems that were “massive in magnitude.” The latest version currently is not “capable of handling more advanced process analysis questions, even when they are based on fairly standard templates,” he said. ChatGPT was able to correct itself after",[],0.2,"['intelligence', 'United', 'growing', 'important', 'remarkable', 'ability', 'like', 'intelligence', 'legal', 'amazing', 'excellent', 'good', 'solution', 'Launched', 'natural', 'ability', 'like', 'useful', 'creating', 'creating', 'value', 'value', 'surprising', 'advanced']","['cheat', 'failed', 'problem', 'errors', 'mistakes', 'problems', 'capable']"
10,ChatGPT Maker OpenAI Releases Tool to Check If Text Was Written by a Human,"OpenAI, the maker of chatbot ChatGPT, announced on Tuesday that it has released a new software tool to help detect whether someone is trying to pass off AI-generated text as something that was written by a person. The tool, known as a classifier, comes two months after the release of ChatGPT, a chatbot that generates human-like responses based on the input it is given. Schools were quick to limit ChatGPT’s use over concerns that it could fuel academic dishonesty and hinder learning, as students have been using the chatbot to create content that they are passing off as their own. OpenAI researchers said that while it was “impossible to reliably detect all AI-written text,” good classifiers could pick up signs that text was written by AI. They said the tool could be useful in cases where AI was used for “academic dishonesty” and when AI chatbots were positioned as humans. In a press release, OpenAI warns the classified’s public beta mode is “not fully reliable,” saying that it aims to collect feedback and share improved methods in the future. The firm admitted the classifier only correctly identified 26 percent of AI-written English texts. It also incorrectly labeled human-written text as AI-written 9 percent of the time. The classifier also has several limitations, including its unreliability on text below 1,000 characters, as well as misidentifying some human-written text as AI-written. It also only works in English for now, as it performs “significantly worse in other languages and it is unreliable on code.” Finally, AI-written text can be edited to evade the classifier, according to OpenAI. “It should not be used as a primary decision-making tool, but instead as a complement to other methods of determining the source of a piece of text,” OpenAI said. ChatGPT is a free program that generates text in response to a prompt, including articles, essays, jokes, and even poetry. Since ChatGPT debuted in November 2022 and gained wide popularity among millions of users, some of the largest U.S. school districts have banned the AI chatbot over concerns that students will use the text generator to cheat or plagiarize. Following the wave of attention, last week Microsoft announced a multibillion-dollar investment in OpenAI, a research-oriented San Francisco startup, and said it would incorporate the startup’s AI models into its products for consumers and businesses.",[],0.2,"['help', 'like', 'create', 'good', 'useful', 'share', 'improved', 'admitted', 'well', 'free', 'jokes', 'gained', 'popularity']","['warns', 'worse', 'banned', 'cheat']"
11,Gmail Creator Warns ChatGPT Challenges Google’s Search Engine Dominance,"Gmail’s developer Paul Buccheit thinks that the new artificial intelligence (AI) bot ChatGPT could dethrone Google’s online search capability. “Google may be only a year or two away from total disruption,” Buccheit wrote in a tweet on Dec. 1, 2022, the day after San Fransisco-based tech company OpenAI launched its chatbot ChatGPT. “AI will eliminate the Search Engine Result Page, which is where they make most of their money,” he wrote. “Even if they catch up on AI, they can’t fully deploy it without destroying the most valuable part of their business.” He went on to say that AI bots like ChatGPT will do to Google search what Google did to the yellow pages (a print telephone directory of businesses, organized by category, within a specific geographical location)—render it obsolete. The Washington Post explained how Google search works as compared to ChatGPT. Google works by “crawling billions of web pages, indexing that content and then ranking it” with the most relevant answers listed on top in what’s called a search engine result page (SERP). In contrast, ChatCPT “gives a single, immediate response” based “on its own search and synthesis of the information,” which gives consumers what they need quickly without any “scanning of other websites.” Google primarily makes its money through advertising, CNBC reported. The Google search engine, though free to use for consumers, is monetized. According to data compiled by FourWeekMBA, 81 percent of Alphabet’s (Google’s parent company) $257 billion in net sales came from paid advertising in 2021. Google has spent several years working on chatbots of its own. One in particular, called LaMDA (or Language Model for Dialogue Applications), may even rival ChatGPT in its abilities, The New York Times reported. However, the Times noted, Google may be “reluctant to deploy” the new AI chatbot technology as a replacement for online search because “it is not suited to delivering digital ads.” “Google has a business model issue,” CEO and cofounder of Vectara Amr Awadallah, who worked for Yahoo and Google in the past, told NYT. “If Google gives you the perfect answer to each query, you won’t click on any ads.” Google is designed “with the purpose of ‘Let’s get you to click on a link,’” Sridhar Ramaswamy, who oversaw Google’s ads and commerce business between 2013 and 2018, told The Washington Post. “The goal of Google search is to get you to click on links, ideally ads, and all other text on the page is just filler,” he said, adding that ChatGPT’s system of generative search will disrupt Google’s way of doing business “in a big way.” According to Statista, Google is the most frequently used search engine worldwide, accounting for 84 percent of the global search market share as of December 2022. The second-place spot last year went to Microsoft’s Bing with a mere 9 percent. However, Microsoft seems to be gearing up to take Google on. According to an announcement on Jan. 23, Microsoft has been a multiyear, multibillion-dollar investor in OpenAI since 2019. The tech giant has already invested $1 billion, moz.com reported, with possibly",[],0.13,"['intelligence', 'launched', 'destroying', 'valuable', 'like', 'top', 'free', 'abilities', 'perfect', 'ideally', 'share']","['disruption', 'obsolete', 'reluctant']"
12,Microsoft Rolls out Chatgpt-Powered Teams Premium,"Microsoft Corp. on Wednesday rolled out a premium Teams messaging offering powered by ChatGPT to simplify meetings using the AI chatbot that has taken Silicon Valley by a storm. The premium service will cost $7 per month in June before increasing to $10 in July, Microsoft said. OpenAI-owned ChatGPT will generate automatic meeting notes, recommend tasks and help create meeting templates for Teams users. Microsoft, which announced a multi-billion dollar investment in OpenAI earlier this month, has said it aims to add ChatGPT’s technology into all its products, setting the stage for more competition with rival Alphabet Inc.’s Google. The chatbot, which can produce prose or poetry on command, is at the forefront of generative AI, a space where more and more big tech companies are funneling their resources in. ChatGPT on Wednesday announced a $20 per-month subscription plan, which will let subscribers receive access to faster responses and priority access to new features and improvements.",[],0.17,"['recommend', 'help', 'create', 'improvements']",['funneling']
13,"Google Announces ‘Bard,’ an AI Chatbot Rival to ChatGPT","Google on Monday announced a new artificial intelligence (AI) chatbot called “Bard” that will rival the currently popular ChatGPT. “Two years ago we unveiled next-generation language and conversation capabilities powered by our Language Model for Dialogue Applications (or LaMDA for short),” Google CEO Sundar Pichai said in a blog post. “We’ve been working on an experimental conversational AI service, powered by LaMDA, that we’re calling Bard.” Google is opening up the technology to “trusted testers” before making it more widely available to the public, he said. Google plans to let individual developers, creators, and enterprises try its conversational services, “initially powered by LaMDA with a range of models to follow,” starting next month, he added. Pichai also said Google plans to integrate AI features such as LaMDA into its dominant search engine to help generate responses for more complex queries—”questions where there’s no one right answer.” Currently, Google works by indexing content from the billions of webpages that it crawls, and then ranking it by order of relevance to users’ queries. “Soon, you’ll see AI-powered features in Search that distill complex information and multiple perspectives into easy-to-digest formats, so you can quickly understand the big picture and learn more from the web: whether that’s seeking out additional perspectives, like blogs from people who play both piano and guitar, or going deeper on a related topic, like steps to get started as a beginner,” he said, although he didn’t provide a specific timeline for the rollout. Minutes after Google unveiled Bard on Monday, Microsoft announced it is holding a press event on Tuesday at its Redmond headquarters. Reports speculate the company is expected to announce an AI integration into its search engine Bing. Rival to Microsoft-Backed ChatGPT Google’s announcement of Bard comes just two weeks after Microsoft announced a new multibillion-dollar investment into OpenAI, the maker of ChatGPT and other artificial intelligence tools. Microsoft has been a multibillion-dollar investor in OpenAI since 2019. ChatGPT has reached tens of millions of users since its release as a free prototype to the public on Nov. 30, 2022. At times, the AI service turned away users because of explosive growth. It’s yet unclear how Bard is different from ChatGPT. Pichai said the new service draws on information from the internet, while ChatGPT’s knowledge is up to date as of 2021. According to a demo of Bard, the service, just like ChatGPT, tells users to provide it with a prompt. Users are told they can use Bard to “Plan a friend’s baby shower,” “Compare two Oscar nominated movies,” and “Get lunch ideas based on what’s in your fridge.” The demo also shows Bard generating three bulleted answers to a query asking about new discoveries by a space telescope. “Bard can be an outlet for creativity, and a launchpad for curiosity,” Pichai wrote. He didn’t say whether Bard could write prose like William Shakespeare, who may have inspired the service’s name. Pichai said that Google is relying on a “lightweight” model version LaMDA that “requires significantly less computing power” so that it can service more users, thereby allowing",[],0.23,"['intelligence', 'popular', 'trusted', 'help', 'easy', 'like', 'play', 'like', 'Backed', 'intelligence', 'reached', 'free', 'growth', 'like', 'friend', 'creativity', 'like', 'inspired']","['no', 'unclear']"
