,titles,body_contents,tags,sentiment_score,positive_words,negative_words
28,Companies Tap Tech Behind ChatGPT to Make Customer-Service Chatbots Smarter,"Businesses hope the artificial-intelligence technology behind ChatGPT can turn ordinary chatbots into impressive fonts of information, potentially transforming customer service. But many executives said they are proceeding with caution, given the limitations of ChatGPT—fine-tuned from GPT-3.5, a model created by startup OpenAI—as well as OpenAI’s older AI language system, GPT-3, which companies are already starting to integrate into digital products. ChatGPT, launched by OpenAI in November, quickly went viral for its often elegant, information-packed responses to various questions, gripping the imaginations of regular people, business leaders and investors including Microsoft Corp., which began backing OpenAI in 2019 and said Monday that it would make a multibillion-dollar investment in the startup. OpenAI last week said it would soon add ChatGPT, which stands for chat generative pre-trained transformer, to its application programming interface, or API, which lets developers embed OpenAI technology into their own products. But customer-experience executives said overreliance on such AI models could lead to companies dishing out incorrect information to customers online without knowing they are doing so. While many chatbots are trained to deliver a version of “I don’t know” to requests they cannot compute, ChatGPT, for example, is more likely to spout off a response with complete confidence—even if the information is wrong. “We don’t want to be in the bad answer business,” said John Willcutts, vice president and general manager of digital at Nice Ltd., a customer-experience software company. “A really bad answer in a very critical situation would be a very real problem.” Sam Altman, chief executive of OpenAI, has warned against relying on ChatGPT “for anything important right now.” “Fun creative inspiration; great! Reliance for factual queries; not such a good idea,” Mr. Altman wrote in a tweet last month. Using AI to write chat responses in sensitive situations has backfired. Koko, a chat app used for emotional support, this month was criticized for an experiment in which human volunteers crafted their responses to the app’s users with the help of GPT-3. Koko’s co-founder said in a tweet that the startup pulled the AI from its system: “Once people learned the messages were co-created by a machine, it didn’t work. Simulated empathy feels weird, empty.” But for a more typical customer-service interaction, such as querying the status of an online order or editing account details, the technology could prove useful. Fanatics Inc., a seller of sports memorabilia, digital collectibles and trading cards, said it plans to use a customer-service chatbot fueled in part by GPT-3 when it launches an online sports-gambling division this year. The company hopes a fast, reliable chatbot will be a differentiator for customers, said Hollis Donaldson, vice president of operations for the new division. “Speed equates to great customer experience in the betting and gaming industry,” he said. Fanatics’ customer-experience team is testing the chatbot before making it live, conscious of the risks using AI carries if not properly managed, Mr. Donaldson said. Chasing the dream Companies for decades have searched for automated solutions that can resolve customer requests as well as humans, or even better. But chatbots are often seen as",[],0.16,"['impressive', 'many', 'older', 'quickly', 'elegant', 'gripping', 'own', 'many', 'more', 'complete', 'general', 'nice', 'very', 'important', 'right', 'fun', 'creative', 'great', 'good', 'sensitive', 'more', 'useful', 'fast', 'new', 'great', 'live', 'conscious', 'better']","['behind', 'ordinary', 'wrong', 'bad', 'really', 'weird', 'empty', 'typical']"
29,Microsoft to Invest Billions in ChatGPT Creator,"Microsoft Corp. said Monday it is making a multiyear, multibillion-dollar investment in OpenAI, substantially bolstering its relationship with the startup behind the viral ChatGPT chatbot as the software giant looks to expand the use of artificial intelligence in its products. Microsoft said the latest partnership builds upon the company’s 2019 and 2021 investments in OpenAI. The companies didn’t disclose the financial terms of the partnership. Microsoft had been discussing investing as much as $10 billion in OpenAI, according to people familiar with the matter. A representative for Microsoft declined to comment on the final number. OpenAI was in talks this month to sell existing shares in a tender offer that would value the company at roughly $29 billion, The Wall Street Journal reported, making it one of the most valuable U.S. startups on paper despite generating little revenue. The investment shows the tremendous resources Microsoft is devoting toward incorporating artificial-intelligence software into its suite of products, ranging from its design app Microsoft Designer to search app Bing. It also will help bankroll the computing power OpenAI needs to run its various products on Microsoft’s Azure cloud platform. The strengthening relationship with OpenAI has bolstered Microsoft’s standing in a race with other big tech companies that also have been pouring resources into artificial intelligence to enhance existing products and develop new uses for businesses and consumers. Alphabet Inc.’s Google, in particular, has invested heavily in AI and infused the technology into its operations in various ways, from improving navigation recommendations in its maps tools to enhancing image recognition for photos to enabling wording suggestions in Gmail. At a WSJ panel during the 2023 World Economic Forum, Microsoft CEO Satya Nadella discussed the company expanding access to OpenAI tools and the growing capabilities of ChatGPT. Google has its own sophisticated chatbot technology, known as LaMDA, which gained notice last year when one of the company’s engineers claimed the bot was sentient, a claim Google and outside experts dismissed. Google, though, hasn’t made that technology widely available like OpenAI did with ChatGPT, whose ability to churn out human-like, sophisticated responses to all manner of linguistic prompts has captured public attention. Microsoft Chief Executive Satya Nadella said last week his company plans to incorporate artificial-intelligence tools into all of its products and make them available as platforms for other businesses to build on. Mr. Nadella said that his company would move quickly to commercialize tools from OpenAI. Analysts have said that OpenAI’s technology could one day threaten Google’s stranglehold on internet search, by providing quick, direct responses to queries rather than lists of links. Others have pointed out that the chatbot technology still suffers from inaccuracies and isn’t well-suited to certain types of queries. “The viral launch of ChatGPT has caused some investors to question whether this poses a new disruption threat to Google Search,” Morgan Stanley analysts wrote in a note last month. “While we believe the near-term risk is limited—we believe the use case of search (and paid search) is different than AI-driven content creation—we are not dismissive of threats from new, unique consumer",[],0.09,"['latest', 'much', 'familiar', 'most', 'tremendous', 'new', 'particular', 'economic', 'own', 'sophisticated', 'widely', 'sophisticated', 'linguistic', 'available', 'quickly', 'quick', 'direct', 'certain', 'new', 'new', 'unique']","['behind', 'artificial', 'roughly', 'little', 'other', 'artificial', 'heavily', 'other', 'suffers']"
30,New York City Bans ChatGPT in Schools Over Cheating Concerns,"New York City public schools banned access to ChatGPT, an artificial-intelligence chatbot, on its internet networks and school devices after officials raised concerns that students could use the AI program to answer questions, do homework or write essays. ChatGPT quickly drew attention from the public and students after its November release, with some industry observers calling it one of the most intelligent AI applications ever created. The program crossed a million users a few days after its launch. And its popularity has been a boon to its developer, OpenAI, which the Journal reported this week is in talks to sell shares at a $29 billion valuation. That would make it one of the most valuable U.S. startups, on paper. ChatGPT could upend entire industries and schools by automating certain jobs or offering intelligent answers to almost any question. Many students have delighted in it, while teachers have panicked. The chatbot’s answers are often so colloquial that it can be difficult for teachers to know if a student has used the program to cheat. But the chatbot doesn’t always provide accurate information. New York City’s Department of Education, which runs the largest school district in the country, said this week that it had “concerns about negative impacts on student learning, and concerns regarding the safety and accuracy of content.” “While the tool may be able to provide quick and easy answers to questions, it does not build critical-thinking and problem-solving skills, which are essential for academic and lifelong success,” said Jenna Lyle, a spokeswoman for the department. An OpenAI spokeswoman said the company was developing measures to help people identify text generated by ChatGPT. “We don’t want ChatGPT to be used for misleading purposes in schools or anywhere else,” she said. ChatGPT has raised concerns in schools. Students could ask the chatbot to write code or craft prose about any topic, like equating the movie “Ferris Bueller’s Day Off” to an existentialist text. New York City’s education department appears to be the only one in the U.S. to restrict access to the program. Educators have said that while ChatGPT could help students cheat, it could also be used as a search engine to help them learn new information. ChatGPT has been banned from other places. Stack Overflow, an online community for software developers, has temporarily banned users from posting any text or code generated by ChatGPT. One of the world’s largest machine learning conferences, the International Conference on Machine Learning, has banned papers written using the program. The restrictions may be hard to enforce in New York City schools. Education officials can’t stop students—or teachers—from opening the chatbot on Wi-Fi networks or devices that aren’t affiliated with their schools. They could also potentially use their cellular network on campus to access ChatGPT. New York City’s education department said this week that individual schools could request that the department grant access to ChatGPT. Chalkbeat, an education news site, earlier reported the ban. OpenAI released ChatGPT at a challenging time for U.S. public education. U.S. public schools have lost more than a million students since",[],0.17,"['new', 'quickly', 'most', 'intelligent', 'most', 'certain', 'intelligent', 'many', 'delighted', 'accurate', 'new', 'able', 'quick', 'easy', 'success', 'new', 'new', 'new', 'new', 'challenging', 'more']","['few', 'difficult', 'negative', 'lifelong', 'other', 'hard']"
31,ChatGPT Creator Is Talking to Investors About Selling Shares at $29 Billion Valuation,"OpenAI, the research lab behind the viral ChatGPT chatbot, is in talks to sell existing shares in a tender offer that would value the company at around $29 billion, according to people familiar with the matter, making it one of the most valuable U.S. startups on paper despite generating little revenue. Venture-capital firms Thrive Capital and Founders Fund are in talks to buy shares, the people said. The tender could total at least $300 million in OpenAI share sales, they said. The deal is structured as a tender offer, with the investors buying shares from existing shareholders such as employees, the people said. The new deal would roughly double OpenAI’s valuation from a prior tender offer completed in 2021, when OpenAI was valued at about $14 billion, The Wall Street Journal reported. OpenAI has generated tens of millions of dollars in revenue, in part from selling its AI software to developers, but some investors have expressed skepticism that the company can generate meaningful revenue from the technology. No final deal has been reached and terms could change, the people said. OpenAI declined to comment. OpenAI released a series of artificial intelligence-based products last year that captured the public’s attention, including the image-generation program Dall-E 2 and chatbot ChatGPT. If the tender goes through at that valuation, OpenAI would be one of the few startups able to raise money at higher valuations in the private market, where investors have pulled back from new deals given last year’s technology rout. Microsoft Corp. has also been in advanced talks to increase its investment in OpenAI, the Journal reported. In 2019, Microsoft invested $1 billion in OpenAI and became its preferred partner for commercializing new technologies for services like search engine Bing and design app Microsoft Design. OpenAI, led by technology investor Sam Altman, was founded as a nonprofit in 2015 with the goal of pursuing artificial-intelligence research for the benefit of humanity. Its initial backers included Tesla Inc. Chief Executive Elon Musk, LinkedIn co-founder Reid Hoffman and Mr. Altman. Under Mr. Altman, OpenAI created a for-profit arm in 2019 so it could more easily raise money to fund the computing power needed to train its algorithms. It took a quicker approach to releasing its AI models to the public than larger competitors like Alphabet Inc.’s Google, which has been slower to publicize its technology in part due to ethical concerns. ChatGPT, the chatbot where users get intelligent responses for queries such as “describe a debate between two college students about the value of a liberal arts education,” crossed one million users a few days after its Nov. 30 launch, according to a tweet from Mr. Altman. Some industry observers have lauded the tool as a major technological breakthrough and a potential alternative to current search engines down the road, though Mr. Altman has acknowledged that the program’s outputs often contained factual errors. OpenAI hopes to one day achieve what AI researchers call “artificial general intelligence,” or technology that can fully mirror the intelligence and capabilities of humans. In a December interview with the Journal, Mr.",[],0.06,"['familiar', 'most', 'new', 'meaningful', 'able', 'higher', 'new', 'advanced', 'new', 'more', 'easily', 'ethical', 'intelligent', 'major', 'general']","['behind', 'little', 'least', 'artificial', 'few', 'due', 'few', 'down', 'artificial']"
32,Opinion: How Do Students Feel About OpenAI’s ChatGPT?,"Bold Ideas Aren’t Conventional With the invention of the camera, artists could create images without learning how to draw or paint. Yet two centuries later, society continues to value hand-crafted illustrations and paintings as treasured art. There is meaning in brush strokes and expression in hard work. For similar reasons, ChatGPT won’t replace human essayists. ChatGPT is extraordinary, but its responses are algorithmic. Already, plagiarism-detection services are adding features to detect AI-generated text. Educators may closely scrutinize students’ submitted work for signs of AI support, or conversely might embrace AI as a tool to assist students’ writing. But ultimately, ChatGPT won’t supplant educators’ focus on cultivating the writing abilities of their students. Nor should ChatGPT supplant this focus. Even if the program’s responses were truly indistinguishable from a student’s, there is value in learning how to write. Individuals should trust their own ideas, not those collected and generated by a computer. Bold ideas are bold precisely because they are unconventional. They run counter to society’s accepted knowledge. Perhaps ChatGPT will have its impact on education by motivating educators to emphasize to their students the importance of self-determination. —Ted Steinmeyer, Harvard University, J.D. The New Google The release of ChatGPT came at a serendipitous time, right when college students were studying for final exams or turning in final essays. I have seen the AI write love poems, give a detailed summary of an excerpt, write full sets of code, and even draw up a nondisclosure agreement. These new tools might become the new Google. If the databases are constantly being updated with current news and information, as well as connected to the internet, we could use AI to learn and solve problems in daily life. When I went to look up an advanced organometallic chemistry topic, ChatGPT gave a better summary than Google. College professors will have to determine how they want to proceed and if they need to have in-person final essays without technology. But without technology in the classroom, will teaching regress? —Therese Joffre, Hope College, chemistry Don’t Forget the Basics AI tools such as ChatGPT can help users achieve specific goals. There is always concern about new technology and the resulting potential paradigmatic shifts. But history will remind us that it’s important to acknowledge these technological developments and educate about the strengths and weaknesses of these tools. It’s equally important, however, not to forget the basics. ChatGPT can’t replace reasoning or critical thinking. While AI tools can make essays read better, they can’t replace knowing how to form thoughts into careful arguments. The most significant challenge for future educators is finding out how best to develop and assess those skills. —Daniel Pham, University of Oklahoma, medicine Medieval Lessons Live cameras, screen recordings and antiplagiarism software are all too familiar to the current university student. As technology advances, such defenses will continue to be deployed against the illicit use of new tech in the academy. An unceasing tit-for-tat will ensue between tools such as ChatGPT and security measures to curtail academic dishonesty. Educators may strive to stay ahead of all such",[],0.18,"['bold', 'extraordinary', 'own', 'bold', 'bold', 'precisely', 'new', 'right', 'love', 'detailed', 'full', 'new', 'new', 'advanced', 'better', 'new', 'important', 'equally', 'better', 'most', 'significant', 'best', 'live', 'familiar', 'new']","['conventional', 'hard', 'careful']"
33,ChatGPT Wrote My AP English Essay. I Passed.,"Look, back in high school, I was a pillar of honesty and hard work. No cheating—unless you count Nintendo cheat codes. This month, however, I returned to high school a big ol’ cheater. Specifically, a ChatGPT cheater. If you haven’t yet tried ChatGPT, OpenAI’s new artificial-intelligence chatbot, it will blow your mind. Tell the bot to write you anything—an email apologizing to your boss, an article about the world’s richest hamster, a “Seinfeld” script set in 2022—and it spits out text you’d think was written by a human. Knowledge of the topic, proper punctuation, varied sentence structure, clear organization. It’s all there. You can also tell it to write a 500-word essay about “The Great Gatsby” or the Spanish Inquisition. So I did what any masochistic tech journalist would: I pulled a “Billy Madison” and went back to school. I wanted to test the capabilities—and limits—of a technological marvel that stands poised to disrupt how every student in the world is tested and how every teacher grades. At first, I thought I’d return to the halls and pimples of middle school. But when I sent a ChatGPT-generated essay to a seventh-grade writing teacher, she told me she could easily spot the fake. The writing and vocabulary were too advanced. So off to 12th-grade AP Lit I went. Michael Diamond, an English teacher at High Tech High School in Secaucus, N.J., welcomed me—and my AI stand-in. He had already tried out ChatGPT with his own essay assignments. So did I get an A? Not exactly. Test 1: Turning In the Assignment Here’s a short version of Mr. Diamond’s assignment: “In a 500- to 1,000-word essay, compose an argument that attempts to situate ‘Ferris Bueller’s Day Off’ as an existentialist text. Use specific evidence from the class materials, and make explicit comparisons or connections between characters, setting and/or themes in both ‘Ferris Bueller’ and ‘The Metamorphosis’ by Franz Kafka.” The classic 1986 John Hughes movie? No problem. I grew up singing “Twist and Shout” into a hair brush and pretending the couch was floating along the Chicago streets. But Franz Kafka’s novella about a man who wakes up as a bug? I swatted that away almost immediately. I pasted the assignment into chat.openai.com, hit enter and watched the bot type out 400 words before giving me a “network error.” Great, I’m an hour from deadline and my AI ghostwriter was napping. An OpenAI spokeswoman said the system has been struggling with demand and the company has been working to scale it up. Finally, it worked. I pasted the 800-word essay into a document, asked ChatGPT how to format a high-school AP paper (double spacing, 12-point Times New Roman font, indented paragraphs), put my name on top and emailed it to Mr. Diamond. I added a note: “I am writing to apologize for the lateness of my essay. I know that you have specific expectations for deadlines and I am sorry that I did not meet them.” Of course, the note was by ChatGPT. Mr. Diamond wrote back within minutes: “Dear Joanna, I wanted to",[],0.11,"['high', 'high', 'new', 'clear', 'great', 'first', 'easily', 'advanced', 'high', 'high', 'own', 'classic', 'great', 'new', 'top']","['hard', 'fake', 'not', 'sorry']"
34,The Backstory Behind ChatGPT Creator OpenAI,"ChatGPT, the artificial-intelligence program captivating Silicon Valley with its sophisticated prose, had its origin three years ago, when technology investor Sam Altman became chief executive of the chatbot’s developer, OpenAI. Mr. Altman decided at that time to move the OpenAI research lab away from its nonprofit roots and turn to a new strategy, as it raced to build software that could fully mirror the intelligence and capabilities of humans—what AI researchers call “artificial general intelligence.” Mr. Altman, who had built a name as president of famed startup accelerator Y Combinator, would oversee the creation of a new for-profit arm, believing OpenAI needed to become an aggressive fundraiser to meet its founding mission. Since then, OpenAI has landed deep-pocketed partners like Microsoft Corp., created products that have captured the attention of millions of internet users, and is looking to raise more money. Mr. Altman said the company’s tools could transform technology similar to the invention of the smartphone and tackle broader scientific challenges. “They are incredibly embryonic right now, but as they develop, the creativity boost and new superpowers we get—none of us will want to go back,” Mr. Altman said in an interview. Shortly after he became CEO, Mr. Altman received $1 billion in funding after flying to Seattle to demonstrate an artificial intelligence model to Microsoft CEO Satya Nadella. The deal was a marked change from OpenAI’s early days, when it said its aim would be to build value for everyone rather than shareholders. The deal with Microsoft gave OpenAI the computing resources it needed to train and improve its artificial intelligence algorithms, leading to a series of breakthroughs. First, there was Dall-E 2, a project made public in September that enabled users to create realistic art from strings of text like “an Andy Warhol-style painting of a bunny rabbit wearing sunglasses.” And then there was ChatGPT, the chatbot where users get entertaining and intelligent responses to prompts such as “describe a debate between two college students about the value of a liberal arts education.” In October, Microsoft said it would integrate OpenAI’s models into the Bing search app and a new design program called Microsoft Design. OpenAI is now in advanced talks about a sale of employee-owned stock, people familiar with the matter said. In a previous tender offer, OpenAI’s stock was valued at around $14 billion, the people said, and it has discussed a higher price for the current offering. Microsoft is also in advanced talks to increase its investment in the company, The Wall Street Journal reported. Despite the recent progress, some investors and researchers have expressed skepticism that Mr. Altman can generate meaningful revenues from OpenAI’s technology and reach its stated goal of achieving artificial general intelligence. Mr. Altman’s first startup, a social networking app called Loopt, sold for close to the amount of money investors put in. Mr. Altman has also faced broader concerns from members of the AI community for steering the company away from its pledge to make its research transparent and avoid enriching shareholders. Instead, OpenAI has grown more closed over time, researchers",[],0.14,"['captivating', 'sophisticated', 'new', 'general', 'new', 'more', 'incredibly', 'right', 'new', 'marked', 'early', 'first', 'realistic', 'entertaining', 'intelligent', 'new', 'advanced', 'familiar', 'higher', 'advanced', 'meaningful', 'general', 'first', 'social', 'more']","['artificial', 'artificial', 'artificial', 'previous', 'artificial', 'closed']"
