,titles,body_contents,tags,sentiment_score,positive_words,negative_words
6,"As ChatGPT hype soars, FTC warns Silicon Valley not to oversell its AI","The Federal Trade Commission fired a shot across the bow of Silicon Valley giants speeding ahead on new artificial intelligence products on Monday, warning companies against misleading consumers about what budding tools like ChatGPT may offer. “Marketers should know that — for FTC enforcement purposes — false or unsubstantiated claims about a product’s efficacy are our bread and butter,” the agency said in a post. The remarks could foreshadow future clashes between regulators and tech companies, who have kicked off an industry-wide AI arms race as they try to capitalize on the popularity of the OpenAI chatbot. Without explicitly mentioning ChatGPT, a bot that produces humanlike responses to users’ queries, FTC attorney Michael Atleson wrote in the blog post that the “AI hype is playing out today across many products, from toys to cars to chatbots and a lot of things in between.” Atleson said that “some products with AI claims might not even work as advertised in the first place,” and that the “lack of efficacy may exist regardless of what other harm the products might cause.” The comments offer a road map for how regulators may scrutinize the tech sector’s deepening use of AI across products, and signals deceptive claims will likely be a major focus. The agency laid out four potential abuses they plan to track: making exaggerated claims about what a product may do, making unsubstantiated promises about how AI makes a product better and perhaps costlier, failing to foresee and mitigate risks posed by the tool, and making baseless claims about the degree to which a company is actually using AI. The FTC has previously warned companies that it’s on the lookout for discriminatory uses of AI, including whether “algorithms developed for benign purposes like healthcare resource allocation and advertising” can inadvertently lead to “racial bias.” The push is part of a broader focus under the Biden administration on “equity” in technology use. Atleson noted that the FTC can use its in-house technologists to “look under the hood and analyze other materials to see if what’s inside matches up with your claims.” The agency plans to more than double the number of technologists it has on staff as it launches a new office dedicated in part to keeping up with Silicon Valley giants, as we first reported earlier this month. Tech companies are rapidly doubling-down on their AI development, particularly so-called large language models like the one that powers ChatGPT. They use deep learning tools to analyze and generate text based on massive troves of data. Microsoft announced in January that it is pouring billions in investments into its partnership with OpenAI, the San Francisco based-start-up behind ChatGPT. The tech giant later unveiled plans to “reimagine” its Bing search engine by tapping more deeply into AI. Since then, a slew of tech giants have followed suit. Google, a longtime industry leader on AI, announced earlier this month that it will make its own AI chatbot, Bard, available to the public in the “coming weeks.” Meta CEO Mark Zuckerberg announced Friday the Facebook parent company has trained and will release its own new large language model to researchers, called LLaMa. Chinese tech giants like Tencent and Baidu are also seeking to build off the success of ChatGPT but have run into hurdles around state censorship, as my colleagues reported. While AI investments are only gaining steam in Silicon Valley, the FTC’s remarks show that U.S. regulators are already grappling with questions about how to keep those moves in check. Our top tabs Canada bans TikTok on government devices, following U.S., E.U. Canada became the latest country to prohibit the use of TikTok on government-owned devices, joining the United States federal government and the European Union, the Wall Street Journal’s Paul Vieira reports. Mona Fortier, Canada’s minister responsible for the public service, said officials determined the app “presents an unacceptable level of risk to privacy and security.” A spokeswoman for TikTok said Canada blocked TikTok on government-issued devices “without citing any specific security concern or contacting us with questions.” The move adds ""to a patchwork of bans affecting government employees in the U.S. and Europe, based over national-security concerns about TikTok’s owner, Beijing-based ByteDance,” according to the report. E.U. official defends proposal to make tech giants pay for internet upgrades Thierry Breton, the European Commission’s official in charge of digital policy, defended a plan discussed by the bloc to make tech giants help pay for upgrades to internet networks, the Associated Press reports. “The telecom industry needs to reconsider its business models as it undergoes a ‘radical shift’ fueled by a new wave of innovation such as immersive, data-hungry technologies like the metaverse,” Breton said at the Mobile World Congress event in Barcelona. “The consultation has been described by many as the battle over fair share between Big Telco and Big Tech,” Breton said. “A binary choice between those who provide networks today and those who feed them with the traffic. That is not how I see things.” Google contract workers win raise after labor dispute The Alphabet Workers Union said Monday that thousands of contract workers who inspect Google’s search and advertising tools won a raise — lifting wages up to $15 an hour, Bloomberg News’s Davey Alba reports. “The AWU estimated that as many as 5,000 workers received the raise, which it said resulted in ‘millions in collective salary increases for workers,’” according to the report. “The pay hike came after AWU, which lacks collective bargaining rights, staged rallies on both US coasts to call attention to labor conditions and delivered a petition demanding that all workers receive the benefits Google publicizes in its minimum standard of benefits.” “We are so thrilled to see our collective efforts win another pay increase,” Michelle Curtis, a member of the AWU said in a statement.",[],0.15,"['intelligence', 'like', 'popularity', 'playing', 'promises', 'better', 'benign', 'like', 'number', 'dedicated', 'like', 'like', 'success', 'gaining', 'top', 'United', 'responsible', 'determined', 'security', 'security', 'security', 'help', 'innovation', 'like', 'fair', 'share', 'win', 'won', 'benefits', 'benefits', 'thrilled', 'win', 'increase']","['fired', 'warning', 'misleading', 'lack', 'harm', 'abuses', 'exaggerated', 'failing', 'risks', 'warned', 'bias', 'unacceptable', 'risk', 'blocked', 'pay', 'pay', 'battle', 'dispute', 'pay', 'demanding', 'pay']"
7,Banks Are Right to Clamp Down on Office ChatGPT,"ChatGPT. OK, it’s cool, but what is it for? This is the question I’d be asking if I were a banking executive. Oh, and of course: What are the risks of using it? There is huge excitement about this bright new toy, but what it mainly does is produce content on demand that is distilled from information picked up off the internet. To my mind, what makes it smart is its ability to produce language that sounds like a convincing voice, not the substance of what it is telling you. So why are banks banning it inside their businesses? The answer is in what bankers might use it for. Bank of America Corp. and Goldman Sachs Group Inc. have joined JPMorgan Chase & Co. in telling staff they mustn’t use it for business purposes. Those business purposes could be to generate a draft of a pitch document or research report, just as people have tried it out writing parts of academic papers, press releases or even entire novels. Maybe senior bankers think their juniors will get lazy. More likely, the compliance departments are fretting about the risks involved, especially after being fined by regulators for bankers’ use of WhatsApp. ChatGPT and other large language models have been shown to make mistakes and get things wrong, or even hallucinate and make up non-existent fields of scientific enquiry, for example. If a sell-side analysts’ research report turned out to have plausible but entirely fantastic sectoral developments threatening or benefiting a listed company, I assume that would look bad. Also, as ChatGPT goes around pulling information from the web, there’s a danger that it might end up straight plagiarising someone else’s work. Again, if you’re a bank, or any information-centered business where reputation and trust matters, this would not be good. ChatGPT could also be used to write computer code. Banks would be mad to let it anywhere near their code, however. There would be hurdles anyway for the banks that still have large parts of their systems built on proprietary coding languages that ChatGPT would need to learn. But beyond that, bank regulators and customers have an extremely low tolerance for failure in banking systems – trades need to be confirmed and settled, payments need to be made and companies and people need access to their cash. Banks have to be pretty sure that anything going on their computers is reliable and that they understand exactly what it is doing. But back to the content question: A major selling point for traders, investment bankers and research analysts is their own intellectual content. Companies pay them big bucks to advise on takeovers or raise capital because they know things about rival firms and appetites for risk in markets. For similar reasons, investors pay banks to buy and sell assets, or to help construct bespoke derivatives trades with a plethora of payoffs. Would you want to pay so much if you thought a web-crawling robot was writing the pitch for your business? I’m being somewhat facetious, or course. But the presentation of content is just that: it’s the presentation, it isn’t the know-how, the skill, or the intellectual capital that is behind “the content.” Banks, like most companies, produce an awful lot of spam: Endless, self-promoting marketing materials, releases and brochures to convince people that their services are good — I should probably say “exceptional!” We should poke fun at most of this. But at the same time, for any company that is fundamentally useful, there is real intellectual capability behind this voluminous noise. ChatGPT might be able to produce a beautiful and entirely convincing brochure about new homes, but I’m fairly sure it couldn’t also build, decorate and furnish them. At least not yet. More From Bloomberg Opinion: • Bing, Bard and Opening Up Pandora’s Bots: Parmy Olson • Can ChatGPT Write a Better Novel Than I Can?: Stephen L. Carter • ChatGPT Shows Just How Far Europe Lags in Tech: Lionel Laurent This column does not necessarily reflect the opinion of the editorial board or Bloomberg LP and its owners.",[],0.08,"['OK', 'cool', 'huge', 'excitement', 'bright', 'smart', 'ability', 'like', 'convincing', 'fantastic', 'straight', 'trust', 'matters', 'tolerance', 'pretty', 'sure', 'intellectual', 'assets', 'help', 'want', 'intellectual', 'like', 'promoting', 'convince', 'good', 'fun', 'useful', 'intellectual', 'beautiful', 'convincing', 'sure', 'Better', 'Novel']","['risks', 'demand', 'lazy', 'risks', 'mistakes', 'wrong', 'threatening', 'bad', 'danger', 'good', 'mad', 'low', 'failure', 'pay', 'risk', 'pay', 'pay', 'awful', 'spam', 'Lags']"
8,ChatGPT Shows Just How Far Europe Lags in Tech,"Europe is where ChatGPT gets regulated, not invented. That’s something to regret. As unhinged as the initial results of the artificial-intelligence arms race may be, they’re also another reminder of how far the European Union lags behind the US and China when it comes to tech. How did the land that birthed Nokia Oyj and Ericsson AB become the land that tech forgot? Some blame the acronyms synonymous with Brussels red tape — GDPR, DMA, DSA — even though the Googles of this world look far more spooked by ChatGPT than any EU fine. Tech lobbyists are fuming at EU Commissioner Thierry Breton, who wants incoming AI rules toughened to rein in a new breed of chatbots. But maybe Breton’s old company, Atos SE, is a better example of the deeper malaise plaguing European tech. Aerospace champion Airbus SE has proposed an investment in Evidian, the big-data and cybersecurity unit that Atos plans to spin off this year. The potential deal has been presented as a boost to European tech “sovereignty” through growth in cloud and advanced computing. One look at Atos’s share price will reveal that the company is a symptom of, not a remedy for, Europe’s tech decline. The company doubled revenue and employees in the 2010s through acquisitions, but was too slow to move to the cloud and away from older IT infrastructure. Meanwhile, the likes of Microsoft Corp. and Alphabet Inc. — the companies that are in a race to get chatbots with a personality into every home — splashed huge amounts of cash to grow their own cloud businesses and, together with Amazon.com Inc., control two-thirds of the global market. The R&D gap between US and Europe looks relevant here. Alphabet and Microsoft were among the world’s three biggest corporate spenders in research in 2021, at around $30 billion and $23 billion respectively, according to European Commission data. The only EU company in the top 10 was Volkswagen AG, which spent 15.6 billion euros ($16.6 billion). Airbus was far behind at 2.9 billion euros, as was Atos, at 57 million euros. Policymakers might assume that all it takes to close the gap is to cobble together ever-bigger domestic or regional champions. But aspirations for a “European cloud” have accomplished little. Former Atos executive Olivier Coste, in a new book about Europe’s tech lag, sees the real issue as being more about the high cost of failure in the EU — in the form of corporate restructuring. Unlike in the US, laying off engineers costs several hundreds of thousands of euros per person, takes time to negotiate, and demotivates staff who stay on. That discourages risk-taking on tech projects with a high rate of failure, he reckons. It also explains why 20th Century-era industrial firms — better at incremental, not radical, innovation — outspend 21st-Century tech in the EU. Coste’s prescription is to reduce the cost of failure. He recommends a “flexicurity” approach, Denmark-style, to tech jobs. That would mean more flexibility to hire and fire, offset with the safety net of enough income to protect people who do lose their job. His is far from a consensus view; others suggest more disruptive innovation, like the US Defense Advanced Research Projects Agency, or Darpa. Another idea would be to pay European researchers better. Obviously, Silicon Valley’s recent spate of layoffs after pandemic overhiring doesn’t look like something to emulate. But Atos is hardly in a solid place either. It has dragged its feet on restructuring and now needs 1.6 billion euros in extra funding through 2023. That number is basically equivalent to its current market capitalization, an embarrassment for a firm worth 13 billion euros in 2017. And it’s not even clear that the Evidian spinoff is the best path forward given the growth outlook, according to Bloomberg Intelligence’s Tamlin Bason. It’s not all doom and gloom. Recent moves like the European Investment Bank’s 3.8 billion-euro venture-capital initiative could accelerate investment and innovation. But it’s hard to shake a sense of deja vu as Europe defends its cyber-industrial complex while reining in chatbots. All that’s left is for politicians to call for a “European ChatGPT” — at least until the next big thing comes along.",[],0.11,"['intelligence', 'fine', 'toughened', 'better', 'champion', 'boost', 'growth', 'advanced', 'share', 'likes', 'huge', 'respectively', 'top', 'champions', 'accomplished', 'better', 'recommends', 'flexibility', 'safety', 'protect', 'innovation', 'like', 'Defense', 'Advanced', 'better', 'like', 'solid', 'number', 'worth', 'best', 'growth', 'Intelligence', 'doom', 'like', 'innovation']","['regret', 'lags', 'blame', 'fuming', 'lag', 'failure', 'discourages', 'risk', 'failure', 'innovation', 'failure', 'fire', 'lose', 'disruptive', 'pay', 'dragged', 'embarrassment', 'clear', 'gloom', 'hard', 'shake']"
9,Vanderbilt apologizes for using ChatGPT to write message on MSU shooting,"As students at Vanderbilt University’s Peabody College grappled with the news of a deadly shooting at Michigan State University last week, those in the education college received an odd message from the administration. The Thursday email from Peabody College’s Office of Equity, Diversity and Inclusion addressed the shooting in Michigan but didn’t refer to any Vanderbilt organizations or resources that students could contact for support. It instead described steps to “ensure that we are doing our best to create a safe and inclusive environment for all.” “One of the key ways to promote a culture of care on our campus is through building strong relationships with one another,” the first sentence of one paragraph reads. “Another important aspect of creating an inclusive environment is to promote a culture of respect and understanding,” begins another. A smaller line of text in parentheses at the bottom of the message revealed that it had been written using the generative artificial intelligence program ChatGPT, as first reported by the Vanderbilt Hustler student newspaper. Students blasted the university for using a chatbot to address a harrowed campus community after the Michigan shooting, and Vanderbilt quickly apologized. Nicole Joseph, an associate dean at Peabody’s EDI office who was one of the letter’s three signatories, apologized the next day and said that using ChatGPT was “poor judgment,” the Hustler reported. Camilla Benbow, Peabody College’s dean, said in a statement Saturday that the message was a paraphrased version of a ChatGPT-written draft and that Vanderbilt would investigate the decision to write and send the message. “I remain personally saddened by the loss of life and injuries at Michigan State,” Benbow wrote. “ … I am also deeply troubled that a communication from my administration so missed the crucial need for personal connection and empathy during a time of tragedy.” A Vanderbilt spokesperson directed The Washington Post to Benbow’s statement, which added that Joseph and another assistant dean would step back from positions at Peabody’s EDI office during the investigation. Benbow and Joseph did not immediately respond to requests for comment Monday evening. The Vanderbilt spokesperson did not respond to a question asking whether the university has used ChatGPT in any other official communications. Peabody College’s letter followed an earlier statement from Vanderbilt Vice Provost and Dean of Students G. L. Black on Feb. 14, one day after the shooting at Michigan State, the Hustler reported. Black’s statement — like many issued by universities across the U.S. after the shooting turned the East Lansing college campus into a site of terror — consoled students and provided phone numbers for university mental health resources. It appeared to address the school community in more personal language than Peabody’s AI-generated message. The ChatGPT-written email sent two days later to students in Peabody College, Vanderbilt’s college of education and human development, was sent without the knowledge of university administrators, Benbow said in her statement. University communications are usually subject to multiple reviews before being sent, she added. Students mocked the message as tone-deaf and disrespectful. “It’s hard to take a message seriously when I know that the sender didn’t even take the time to put their genuine thoughts and feelings into words,” Samuel Lu, a Vanderbilt sophomore, told the Hustler. “In times of tragedies such as this, we need more, not less humanity.” Colin Henry, a Ph.D. student at Vanderbilt, told The Post via Twitter message that he believed an equity and inclusion office should discuss criticisms of ChatGPT and other generative programs, like their alleged reliance on underpaid workers to moderate content. He called the decision to instead use the program to address students “graceless.” “I had friends on MSU’s campus in Berkey Hall the night of the shooting,” Henry wrote. “No one expects an institution to comfort you after a tragedy. But you do expect them not to make it worse in a scramble to score PR points.”",[],-0.0,"['support', 'ensure', 'best', 'create', 'safe', 'promote', 'care', 'strong', 'sentence', 'important', 'creating', 'promote', 'respect', 'intelligence', 'apologized', 'apologized', 'like', 'like', 'friends', 'comfort']","['odd', 'poor', 'saddened', 'loss', 'troubled', 'missed', 'tragedy', 'terror', 'mocked', 'hard', 'seriously', 'tragedies', 'criticisms', 'No', 'tragedy', 'worse']"
